{
  "$schema": "https://json-schema.org/draft/2020-12/schema",
  "$id": "https://raw.githubusercontent.com/roian6/apple-health-ai-bridge/main/schemas/health_bridge.batch.v1.schema.json",
  "title": "health_bridge.batch.v1",
  "description": "Every source_key and type_code a row names must be declared in this batch (sources, health_types) or already known to the receiver from an earlier batch; JSON Schema cannot enforce this, so the receiver refuses an undeclared reference with a payload error before writing any row.",
  "type": "object",
  "additionalProperties": false,
  "required": [
    "schema_id",
    "schema_version",
    "generated_at",
    "export_window",
    "sources",
    "health_types",
    "samples",
    "workouts",
    "sleep_sessions",
    "deleted_records",
    "sync"
  ],
  "properties": {
    "schema_id": { "const": "health_bridge.batch.v1" },
    "schema_version": {
      "type": "string",
      "pattern": "^1\\.\\d+\\.\\d+$"
    },
    "generated_at": { "$ref": "#/$defs/utcTimestamp" },
    "export_window": { "$ref": "#/$defs/timeWindow" },
    "sources": {
      "type": "array",
      "maxItems": 5000,
      "minItems": 1,
      "items": { "$ref": "#/$defs/source" }
    },
    "health_types": {
      "type": "array",
      "maxItems": 5000,
      "minItems": 1,
      "items": { "$ref": "#/$defs/healthType" }
    },
    "samples": {
      "type": "array",
      "maxItems": 5000,
      "items": { "$ref": "#/$defs/sample" }
    },
    "workouts": {
      "type": "array",
      "maxItems": 5000,
      "items": { "$ref": "#/$defs/workout" }
    },
    "electrocardiograms": {
      "type": "array",
      "maxItems": 5000,
      "items": { "$ref": "#/$defs/electrocardiogram" }
    },
    "medication_dose_events": {
      "type": "array",
      "maxItems": 5000,
      "items": { "$ref": "#/$defs/medicationDoseEvent" }
    },
    "lab_results": {
      "type": "array",
      "maxItems": 5000,
      "items": { "$ref": "#/$defs/labResult" }
    },
    "sleep_sessions": {
      "type": "array",
      "maxItems": 5000,
      "items": { "$ref": "#/$defs/sleepSession" }
    },
    "deleted_records": {
      "type": "array",
      "maxItems": 5000,
      "items": { "$ref": "#/$defs/deletedRecord" }
    },
    "sync": { "$ref": "#/$defs/syncContext" }
  },
  "$defs": {
    "utcTimestamp": {
      "type": "string",
      "pattern": "^\\d{4}-\\d{2}-\\d{2}T\\d{2}:\\d{2}:\\d{2}Z$"
    },
    "timeWindow": {
      "type": "object",
      "additionalProperties": false,
      "required": ["start_time", "end_time"],
      "properties": {
        "start_time": { "$ref": "#/$defs/utcTimestamp" },
        "end_time": { "$ref": "#/$defs/utcTimestamp" }
      }
    },
    "source": {
      "type": "object",
      "additionalProperties": false,
      "required": ["source_key", "name", "kind"],
      "properties": {
        "source_key": { "type": "string", "pattern": "^(synthetic|apple_health)\\.[a-z0-9_.-]+$" },
        "name": { "type": "string", "minLength": 1 },
        "kind": { "enum": ["phone", "watch", "app", "manual"] },
        "bundle_id": { "type": "string" },
        "device_model": { "type": "string" }
      }
    },
    "healthType": {
      "type": "object",
      "additionalProperties": false,
      "required": ["type_code", "display_name", "category", "default_unit", "sensitivity", "aliases"],
      "properties": {
        "type_code": { "type": "string", "pattern": "^[a-z][a-z0-9_]*$" },
        "display_name": { "type": "string", "minLength": 1 },
        "category": {
          "enum": [
            "activity",
            "blood_respiratory",
            "body",
            "environmental",
            "fitness",
            "heart",
            "other",
            "provider_specific",
            "sleep",
            "workout"
          ]
        },
        "default_unit": { "type": "string", "minLength": 1 },
        "sensitivity": { "enum": ["low", "moderate", "high"] },
        "aliases": {
          "type": "array",
          "items": { "type": "string", "minLength": 1 },
          "uniqueItems": true
        }
      }
    },
    "sample": {
      "type": "object",
      "additionalProperties": false,
      "required": ["client_record_id", "source_key", "type_code", "start_time", "end_time", "value", "unit"],
      "properties": {
        "client_record_id": { "type": "string", "pattern": "^(synthetic|hk)-[a-z0-9-]+$" },
        "source_key": { "type": "string", "pattern": "^(synthetic|apple_health)\\.[a-z0-9_.-]+$" },
        "type_code": { "type": "string", "pattern": "^[a-z][a-z0-9_]*$" },
        "start_time": { "$ref": "#/$defs/utcTimestamp" },
        "end_time": { "$ref": "#/$defs/utcTimestamp" },
        "value": { "type": "number" },
        "unit": { "type": "string", "minLength": 1 },
        "metadata": {
          "type": "object",
          "description": "String map. Optional intake keys: intake_id (lowercase UUID) with intake_component_id (slug) travel together; sync_identifier (1-256 chars) with sync_version (decimal text 1..9223372036854775807, no sign, no leading zero) travel together. Any other key starting with intake_ is rejected by the receiver. The schema mirrors these rules except the numeric int64 upper bound of sync_version, which a pattern cannot express exactly (the pattern allows up to 19 digits); the receiver enforces the bound.",
          "properties": {
            "intake_id": {
              "type": "string",
              "pattern": "^[0-9a-f]{8}-[0-9a-f]{4}-[0-9a-f]{4}-[0-9a-f]{4}-[0-9a-f]{12}(?!\\n)$"
            },
            "intake_component_id": {
              "type": "string",
              "pattern": "^[a-z0-9][a-z0-9._-]{0,63}(?!\\n)$"
            },
            "sync_identifier": {
              "type": "string",
              "minLength": 1,
              "maxLength": 256
            },
            "sync_version": {
              "type": "string",
              "pattern": "^[1-9][0-9]{0,18}(?!\\n)$"
            }
          },
          "patternProperties": {
            "^intake_(?!id(?!\\n)$|component_id(?!\\n)$)": false
          },
          "dependentRequired": {
            "intake_id": ["intake_component_id"],
            "intake_component_id": ["intake_id"],
            "sync_identifier": ["sync_version"],
            "sync_version": ["sync_identifier"]
          },
          "additionalProperties": { "type": "string" }
        }
      }
    },
    "workout": {
      "type": "object",
      "additionalProperties": false,
      "required": [
        "client_record_id",
        "source_key",
        "workout_type",
        "start_time",
        "end_time",
        "duration_seconds"
      ],
      "properties": {
        "client_record_id": { "type": "string", "pattern": "^(synthetic|hk)-[a-z0-9-]+$" },
        "source_key": { "type": "string", "pattern": "^(synthetic|apple_health)\\.[a-z0-9_.-]+$" },
        "workout_type": { "type": "string", "minLength": 1 },
        "start_time": { "$ref": "#/$defs/utcTimestamp" },
        "end_time": { "$ref": "#/$defs/utcTimestamp" },
        "duration_seconds": { "type": "integer", "minimum": 0 },
        "energy_kcal": { "type": "number", "minimum": 0 },
        "distance_meters": { "type": "number", "minimum": 0 }
      }
    },
    "electrocardiogram": {
      "type": "object",
      "additionalProperties": false,
      "required": [
        "client_record_id",
        "source_key",
        "start_time",
        "end_time",
        "classification",
        "symptoms_status",
        "voltage_count"
      ],
      "properties": {
        "client_record_id": { "type": "string", "pattern": "^(synthetic|hk)-[a-z0-9-]+$" },
        "source_key": { "type": "string", "pattern": "^(synthetic|apple_health)\\.[a-z0-9_.-]+$" },
        "start_time": { "$ref": "#/$defs/utcTimestamp" },
        "end_time": { "$ref": "#/$defs/utcTimestamp" },
        "classification": {
          "enum": [
            "not_set",
            "sinus_rhythm",
            "atrial_fibrillation",
            "inconclusive_low_heart_rate",
            "inconclusive_high_heart_rate",
            "inconclusive_poor_reading",
            "inconclusive_other",
            "unrecognized"
          ]
        },
        "symptoms_status": { "enum": ["not_set", "none", "present"] },
        "average_heart_rate_bpm": { "type": "number", "minimum": 0 },
        "sampling_frequency_hz": { "type": "number", "minimum": 0 },
        "voltage_count": { "type": "integer", "minimum": 0, "maximum": 9223372036854775807 },
        "voltages_microvolts": { "type": "array", "items": { "type": "number" } }
      }
    },
    "medicationDoseEvent": {
      "type": "object",
      "additionalProperties": false,
      "required": [
        "client_record_id",
        "source_key",
        "medication_name",
        "status",
        "status_raw",
        "start_time"
      ],
      "properties": {
        "client_record_id": { "type": "string", "pattern": "^(synthetic|hk)-[a-z0-9-]+$" },
        "source_key": { "type": "string", "pattern": "^(synthetic|apple_health)\\.[a-z0-9_.-]+$" },
        "medication_name": { "type": "string", "minLength": 1 },
        "medication_concept_key": { "type": "string", "minLength": 1 },
        "status": {
          "enum": [
            "taken",
            "skipped",
            "not_interacted",
            "snoozed",
            "not_logged",
            "notification_not_sent",
            "unknown"
          ]
        },
        "status_raw": { "type": "integer", "minimum": -9223372036854775808, "maximum": 9223372036854775807 },
        "start_time": { "$ref": "#/$defs/utcTimestamp" },
        "scheduled_time": { "$ref": "#/$defs/utcTimestamp" },
        "dose": { "type": "number", "minimum": 0 },
        "unit": { "type": "string", "minLength": 1 }
      }
    },
    "labResult": {
      "type": "object",
      "additionalProperties": false,
      "required": ["client_record_id", "source_key", "name", "effective_date"],
      "properties": {
        "client_record_id": { "type": "string", "pattern": "^(synthetic|hk)-[a-z0-9-]+$" },
        "source_key": { "type": "string", "pattern": "^(synthetic|apple_health)\\.[a-z0-9_.-]+$" },
        "loinc": { "type": "string", "minLength": 1 },
        "name": { "type": "string", "minLength": 1 },
        "category": { "type": "string", "minLength": 1 },
        "effective_date": { "type": "string", "minLength": 1 },
        "value_num": { "type": "number" },
        "unit": { "type": "string", "minLength": 1 },
        "value_text": { "type": "string", "minLength": 1 },
        "ref_low": { "type": "number" },
        "ref_high": { "type": "number" },
        "ref_text": { "type": "string", "minLength": 1 }
      }
    },
    "sleepStageInterval": {
      "type": "object",
      "additionalProperties": false,
      "required": ["stage", "start_time", "end_time"],
      "properties": {
        "stage": { "enum": ["in_bed", "awake", "core", "deep", "rem"] },
        "start_time": { "$ref": "#/$defs/utcTimestamp" },
        "end_time": { "$ref": "#/$defs/utcTimestamp" }
      }
    },
    "sleepSession": {
      "type": "object",
      "additionalProperties": false,
      "required": ["client_record_id", "source_key", "start_time", "end_time", "stage_intervals"],
      "properties": {
        "client_record_id": { "type": "string", "pattern": "^(synthetic|hk)-[a-z0-9-]+$" },
        "source_key": { "type": "string", "pattern": "^(synthetic|apple_health)\\.[a-z0-9_.-]+$" },
        "start_time": { "$ref": "#/$defs/utcTimestamp" },
        "end_time": { "$ref": "#/$defs/utcTimestamp" },
        "stage_intervals": {
          "type": "array",
          "items": { "$ref": "#/$defs/sleepStageInterval" }
        }
      }
    },
    "deletedRecord": {
      "type": "object",
      "additionalProperties": false,
      "required": ["record_family", "source_key", "client_record_id", "deleted_at"],
      "properties": {
        "record_family": {
          "enum": [
            "sample",
            "workout",
            "sleep_session",
            "electrocardiogram",
            "medication_dose_event",
            "lab_result"
          ]
        },
        "source_key": { "type": "string", "pattern": "^(synthetic|apple_health)\\.[a-z0-9_.-]+$" },
        "client_record_id": { "type": "string", "pattern": "^(synthetic|hk)-[a-z0-9-]+$" },
        "deleted_at": { "$ref": "#/$defs/utcTimestamp" }
      }
    },
    "syncContext": {
      "type": "object",
      "additionalProperties": false,
      "required": ["sync_window", "cursors"],
      "properties": {
        "sync_window": { "$ref": "#/$defs/timeWindow" },
        "cursors": {
          "type": "array",
          "items": { "$ref": "#/$defs/syncCursor" }
        }
      }
    },
    "syncCursor": {
      "type": "object",
      "additionalProperties": false,
      "required": ["source_key", "cursor_kind", "cursor_value"],
      "properties": {
        "source_key": { "type": "string", "pattern": "^(synthetic|apple_health)\\.[a-z0-9_.-]+$" },
        "cursor_kind": { "type": "string", "minLength": 1 },
        "cursor_value": { "type": "string", "minLength": 1 }
      }
    }
  }
}
