{
  "schema_id": "health_bridge.batch.v1",
  "schema_version": "1.0.0",
  "generated_at": "2026-06-08T09:00:00Z",
  "export_window": {
    "start_time": "2026-06-01T00:00:00Z",
    "end_time": "2026-06-08T00:00:00Z"
  },
  "sources": [
    {
      "source_key": "synthetic.phone.alpha",
      "name": "Synthetic Phone Alpha",
      "kind": "phone",
      "bundle_id": "com.example.synthetic.healthbridge",
      "device_model": "SyntheticPhone1,1"
    },
    {
      "source_key": "apple_health.export",
      "name": "Apple Health export.zip import",
      "kind": "manual",
      "bundle_id": "com.example.synthetic.healthbridge",
      "device_model": "SyntheticPhone1,1"
    }
  ],
  "health_types": [
    {
      "type_code": "steps",
      "display_name": "Steps",
      "category": "activity",
      "default_unit": "count",
      "sensitivity": "low",
      "aliases": ["HKQuantityTypeIdentifierStepCount"]
    }
  ],
  "samples": [],
  "workouts": [],
  "lab_results": [
    {
      "client_record_id": "hk-labobs-0123456789abcdef",
      "source_key": "apple_health.export",
      "loinc": "2951-2",
      "name": "Sodium",
      "category": "laboratory",
      "effective_date": "2026-06-04",
      "value_num": 140.0,
      "unit": "mmol/L",
      "ref_low": 136.0,
      "ref_high": 145.0
    }
  ],
  "sleep_sessions": [],
  "deleted_records": [
    {
      "record_family": "sample",
      "source_key": "synthetic.phone.alpha",
      "client_record_id": "synthetic-sample-steps-removed-20260605",
      "deleted_at": "2026-06-05T09:15:00Z"
    }
  ],
  "sync": {
    "sync_window": {
      "start_time": "2026-06-01T00:00:00Z",
      "end_time": "2026-06-08T00:00:00Z"
    },
    "cursors": []
  }
}
